{
  "$schema": "oebf://schema/0.1/profile",
  "id": "profile-nmb-ip-02-a",
  "type": "Profile",
  "description": "NMB-IP-02-A bathroom partition: 30 minutes REI, tanked and tiled one side",
  "svg_file": "profiles/profile-nmb-ip-02-a.svg",
  "width": 0.113,
  "height": null,
  "origin": {
    "x": 0.0565,
    "y": 0.0
  },
  "alignment": "center",
  "profile_type": "wall",
  "height_limit_m": 2.7,
  "assembly": [
    {
      "layer": 1,
      "name": "Skim and paint",
      "material_id": "mat-nmb-skim",
      "thickness": 0.003,
      "function": "finish"
    },
    {
      "layer": 2,
      "name": "Wall lining board",
      "material_id": "mat-nmb-wall-lining-board",
      "thickness": 0.013,
      "function": "finish"
    },
    {
      "layer": 3,
      "name": "Wall lining system with insulation between studs",
      "material_id": "mat-nmb-wall-lining-system",
      "thickness": 0.07,
      "function": "insulation"
    },
    {
      "layer": 4,
      "name": "Wall lining board",
      "material_id": "mat-nmb-wall-lining-board",
      "thickness": 0.013,
      "function": "finish"
    },
    {
      "layer": 5,
      "name": "Robust self adhesive waterproofing membrane",
      "material_id": "mat-nmb-tanking-membrane",
      "thickness": 0.003,
      "function": "membrane"
    },
    {
      "layer": 6,
      "name": "Bathroom wall finish, e.g. tiles",
      "material_id": "mat-nmb-bathroom-finish",
      "thickness": 0.011,
      "function": "finish"
    }
  ]
}
