{
  "$schema": "oebf://schema/0.1/profile",
  "id": "profile-nmb-ip-01-a",
  "type": "Profile",
  "description": "NMB-IP-01-A non-loadbearing partition, apartment/apartment: 30 minutes REI",
  "svg_file": "profiles/profile-nmb-ip-01-a.svg",
  "width": 0.102,
  "height": null,
  "origin": {
    "x": 0.051,
    "y": 0.0
  },
  "alignment": "center",
  "profile_type": "wall",
  "height_limit_m": 2.7,
  "assembly": [
    {
      "layer": 1,
      "name": "Skim and paint",
      "material_id": "mat-nmb-skim",
      "thickness": 0.003,
      "function": "finish"
    },
    {
      "layer": 2,
      "name": "Wall lining board",
      "material_id": "mat-nmb-wall-lining-board",
      "thickness": 0.013,
      "function": "finish"
    },
    {
      "layer": 3,
      "name": "Wall lining system with insulation between studs",
      "material_id": "mat-nmb-wall-lining-system",
      "thickness": 0.07,
      "function": "insulation"
    },
    {
      "layer": 4,
      "name": "Wall lining board",
      "material_id": "mat-nmb-wall-lining-board",
      "thickness": 0.013,
      "function": "finish"
    },
    {
      "layer": 5,
      "name": "Skim and paint",
      "material_id": "mat-nmb-skim",
      "thickness": 0.003,
      "function": "finish"
    }
  ]
}
