{
  "$schema": "oebf://schema/0.1/profile",
  "id": "profile-nmb-iw-05-a",
  "type": "Profile",
  "description": "NMB-IW-05-A service riser wall: CLT with shaft lining both sides, K2 60 + REI 60",
  "svg_file": "profiles/profile-nmb-iw-05-a.svg",
  "width": 0.34,
  "height": null,
  "origin": {
    "x": 0.17,
    "y": 0.0
  },
  "alignment": "center",
  "profile_type": "wall",
  "height_limit_m": 2.777,
  "assembly": [
    {
      "layer": 1,
      "name": "Shaft lining board (320/311)",
      "material_id": "mat-nmb-shaft-lining-board",
      "thickness": 0.015,
      "function": "finish"
    },
    {
      "layer": 2,
      "name": "Shaft lining board (320/311)",
      "material_id": "mat-nmb-shaft-lining-board",
      "thickness": 0.015,
      "function": "finish"
    },
    {
      "layer": 3,
      "name": "Shaft lining system (319)",
      "material_id": "mat-nmb-shaft-lining-system",
      "thickness": 0.05,
      "function": "service"
    },
    {
      "layer": 4,
      "name": "CLT wall panel (301)",
      "material_id": "mat-nmb-clt",
      "thickness": 0.18,
      "function": "structure"
    },
    {
      "layer": 5,
      "name": "Shaft lining system (319)",
      "material_id": "mat-nmb-shaft-lining-system",
      "thickness": 0.05,
      "function": "service"
    },
    {
      "layer": 6,
      "name": "Shaft lining board (320/311)",
      "material_id": "mat-nmb-shaft-lining-board",
      "thickness": 0.015,
      "function": "finish"
    },
    {
      "layer": 7,
      "name": "Shaft lining board (320/311)",
      "material_id": "mat-nmb-shaft-lining-board",
      "thickness": 0.015,
      "function": "finish"
    }
  ]
}
